{
  "schema": "noss.input_preset/1",
  "id": "pad_standard",
  "name": "Controller",
  "device": "gamepad",
  "description": "Left stick steers, triggers drive, right stick looks around.",
  "verified": true,
  "bindings": {
    "steer_left": [
      {
        "axis": "left_x",
        "dir": -1
      }
    ],
    "steer_right": [
      {
        "axis": "left_x",
        "dir": 1
      }
    ],
    "throttle": [
      {
        "axis": "trigger_right",
        "dir": 1
      }
    ],
    "brake": [
      {
        "axis": "trigger_left",
        "dir": 1
      }
    ],
    "handbrake": [
      {
        "button": "a"
      }
    ],
    "shift_up": [
      {
        "button": "right_shoulder"
      }
    ],
    "shift_down": [
      {
        "button": "left_shoulder"
      }
    ],
    "camera_next": [
      {
        "button": "y"
      }
    ],
    "look_back": [
      {
        "button": "right_stick"
      }
    ],
    "look_left": [
      {
        "axis": "right_x",
        "dir": -1
      }
    ],
    "look_right": [
      {
        "axis": "right_x",
        "dir": 1
      }
    ],
    "look_up": [
      {
        "axis": "right_y",
        "dir": -1
      }
    ],
    "look_down": [
      {
        "axis": "right_y",
        "dir": 1
      }
    ],
    "reset_car": [
      {
        "button": "back"
      }
    ],
    "hotswap_menu": [
      {
        "button": "dpad_up"
      }
    ],
    "pause": [
      {
        "button": "start"
      }
    ],
    "editor_back": [
      {
        "button": "dpad_down"
      }
    ],
    "horn": [
      {
        "button": "left_stick"
      }
    ],
    "lights": [
      {
        "button": "x"
      }
    ],
    "drift": [
      {
        "button": "right_shoulder"
      }
    ],
    "use_item": [
      {
        "button": "left_shoulder"
      }
    ],
    "throw_back": [
      {
        "button": "right_stick"
      }
    ],
    "ram": [
      {
        "button": "left_shoulder"
      }
    ],
    "boost": [
      {
        "button": "a"
      }
    ],
    "menu_up": [
      {
        "button": "dpad_up"
      },
      {
        "axis": "left_y",
        "dir": -1
      }
    ],
    "menu_down": [
      {
        "button": "dpad_down"
      },
      {
        "axis": "left_y",
        "dir": 1
      }
    ],
    "menu_left": [
      {
        "button": "dpad_left"
      },
      {
        "axis": "left_x",
        "dir": -1
      }
    ],
    "menu_right": [
      {
        "button": "dpad_right"
      },
      {
        "axis": "left_x",
        "dir": 1
      }
    ],
    "menu_confirm": [
      {
        "button": "a"
      }
    ],
    "menu_cancel": [
      {
        "button": "b"
      }
    ],
    "pit_fuel": [
      {
        "button": "dpad_right"
      }
    ],
    "pit_tyres": [
      {
        "button": "dpad_left"
      }
    ]
  }
}
