{
  "schema": "noss.input_preset/1",
  "id": "kb_right",
  "name": "Keyboard right",
  "device": "keyboard",
  "description": "Arrow side only, no number pad needed. For a shared keyboard, or one hand.",
  "verified": true,
  "bindings": {
    "steer_left": [
      {
        "key": "Left"
      }
    ],
    "steer_right": [
      {
        "key": "Right"
      }
    ],
    "throttle": [
      {
        "key": "Up"
      }
    ],
    "brake": [
      {
        "key": "Down"
      }
    ],
    "handbrake": [
      {
        "key": "Slash"
      }
    ],
    "shift_up": [
      {
        "key": "Period"
      }
    ],
    "shift_down": [
      {
        "key": "Comma"
      }
    ],
    "camera_next": [
      {
        "key": "Semicolon"
      }
    ],
    "look_back": [
      {
        "key": "Apostrophe"
      }
    ],
    "reset_car": [
      {
        "key": "BracketRight"
      }
    ],
    "hotswap_menu": [
      {
        "key": "BracketLeft"
      }
    ],
    "pause": [
      {
        "key": "Backspace"
      }
    ],
    "editor_back": [
      {
        "key": "F8"
      }
    ],
    "horn": [
      {
        "key": "M"
      }
    ],
    "lights": [
      {
        "key": "L"
      }
    ],
    "drift": [
      {
        "key": "Slash"
      }
    ],
    "use_item": [
      {
        "key": "Period"
      }
    ],
    "throw_back": [
      {
        "key": "Apostrophe"
      }
    ],
    "ram": [
      {
        "key": "Period"
      }
    ],
    "boost": [
      {
        "key": "Slash"
      }
    ],
    "menu_up": [
      {
        "key": "Up"
      }
    ],
    "menu_down": [
      {
        "key": "Down"
      }
    ],
    "menu_left": [
      {
        "key": "Left"
      }
    ],
    "menu_right": [
      {
        "key": "Right"
      }
    ],
    "menu_confirm": [
      {
        "key": "Enter"
      }
    ],
    "menu_cancel": [
      {
        "key": "Backspace"
      }
    ],
    "pit_fuel": [
      {
        "key": "9"
      }
    ],
    "pit_tyres": [
      {
        "key": "0"
      }
    ],
    "menu_tab_prev": [
      {
        "key": "Comma"
      }
    ],
    "menu_tab_next": [
      {
        "key": "Period"
      }
    ]
  }
}
